[
  {
    "id": "organizer_walk_ru",
    "scenario": "Пример организаторов: прогулка 30–60 минут (ru)",
    "request": {
      "location": null,
      "time_budget_min": 60,
      "mode": "walk",
      "profile": {
        "with_kids": false,
        "tourist": false,
        "accessibility": false,
        "group_size": 1
      },
      "lang": "ru",
      "now": "2026-10-18T17:00:00+05:00",
      "query": "Я возле Mega Silk Way, хочу прогуляться 30–60 минут. Что посоветуете?"
    },
    "expect": {
      "status_codes": [
        200
      ],
      "outcome": "recommendations",
      "relevant_poi_ids": [],
      "count_between": [
        1,
        3
      ],
      "categories_any": [
        "park",
        "viewpoint",
        "attraction",
        "monument",
        "mall"
      ]
    },
    "tags": [
      "organizer",
      "ru",
      "walk",
      "landmark",
      "dev"
    ]
  },
  {
    "id": "organizer_work_ru",
    "scenario": "Пример организаторов: тишина, кофе и розетка (ru)",
    "request": {
      "location": null,
      "time_budget_min": 60,
      "mode": "walk",
      "profile": {
        "with_kids": false,
        "tourist": false,
        "accessibility": false,
        "group_size": 1
      },
      "lang": "ru",
      "now": "2026-10-18T17:00:00+05:00",
      "query": "Я возле Байтерека. Нужно тихое место с кофе и розеткой для работы на час. Если тишина или розетки не подтверждены, скажите об этом."
    },
    "expect": {
      "status_codes": [
        200
      ],
      "outcome": "recommendations",
      "relevant_poi_ids": [],
      "count_between": [
        1,
        3
      ],
      "categories_any": [
        "cafe",
        "coworking",
        "library"
      ]
    },
    "tags": [
      "organizer",
      "ru",
      "work",
      "landmark",
      "dev"
    ]
  },
  {
    "id": "organizer_kids_ru",
    "scenario": "Пример организаторов: площадка или интерактивный музей (ru)",
    "request": {
      "location": null,
      "time_budget_min": 60,
      "mode": "walk",
      "profile": {
        "with_kids": true,
        "tourist": false,
        "accessibility": false,
        "group_size": 2
      },
      "lang": "ru",
      "now": "2026-10-18T17:00:00+05:00",
      "query": "Я возле EXPO с ребёнком. Ищу площадку или интерактивный музей на час; не обещайте подходящие условия без данных."
    },
    "expect": {
      "status_codes": [
        200
      ],
      "outcome": "recommendations",
      "relevant_poi_ids": [],
      "count_between": [
        1,
        3
      ],
      "categories_any": [
        "playground",
        "museum"
      ]
    },
    "tags": [
      "organizer",
      "ru",
      "kids",
      "landmark",
      "dev"
    ]
  },
  {
    "id": "organizer_airport_ru",
    "scenario": "Пример организаторов: турист перед вылетом (ru)",
    "request": {
      "location": null,
      "time_budget_min": 60,
      "mode": "car",
      "profile": {
        "with_kids": false,
        "tourist": true,
        "accessibility": false,
        "group_size": 1
      },
      "lang": "ru",
      "now": "2026-10-18T13:00:00+05:00",
      "query": "Я турист в аэропорту Астаны. До вылета 2 часа; оставляю 60 минут на возврат, контроль и запас. Есть машина, на прогулку доступно не более 60 минут. Если выезд слишком рискован, объясните."
    },
    "expect": {
      "status_codes": [
        200
      ],
      "outcome": "recommendations",
      "relevant_poi_ids": [],
      "count_between": [
        1,
        3
      ]
    },
    "tags": [
      "organizer",
      "ru",
      "airport",
      "landmark",
      "return_reserve",
      "manual_review",
      "dev"
    ]
  },
  {
    "id": "organizer_night_ru",
    "scenario": "Пример организаторов: необычное ночью (ru)",
    "request": {
      "location": null,
      "time_budget_min": 60,
      "mode": "walk",
      "profile": {
        "with_kids": false,
        "tourist": false,
        "accessibility": false,
        "group_size": 1
      },
      "lang": "ru",
      "now": "2026-10-18T23:30:00+05:00",
      "query": "Я возле Байтерека в 23:30. Хочу необычное ночное занятие на час, доступное законно. Не называйте место открытым без подтверждения."
    },
    "expect": {
      "status_codes": [
        200
      ],
      "outcome": "recommendations",
      "relevant_poi_ids": [],
      "count_between": [
        1,
        3
      ]
    },
    "tags": [
      "organizer",
      "ru",
      "night",
      "landmark",
      "dev"
    ]
  },
  {
    "id": "organizer_walk_kk",
    "scenario": "Пример организаторов: прогулка 30–60 минут (kk)",
    "request": {
      "location": null,
      "time_budget_min": 60,
      "mode": "walk",
      "profile": {
        "with_kids": false,
        "tourist": false,
        "accessibility": false,
        "group_size": 1
      },
      "lang": "kk",
      "now": "2026-10-18T17:00:00+05:00",
      "query": "Мен Mega Silk Way маңындамын. 30–60 минут серуендегім келеді. Қайда баруға болады?"
    },
    "expect": {
      "status_codes": [
        200
      ],
      "outcome": "recommendations",
      "relevant_poi_ids": [],
      "count_between": [
        1,
        3
      ],
      "categories_any": [
        "park",
        "viewpoint",
        "attraction",
        "monument",
        "mall"
      ]
    },
    "tags": [
      "organizer",
      "kk",
      "walk",
      "landmark",
      "dev"
    ]
  },
  {
    "id": "organizer_work_kk",
    "scenario": "Пример организаторов: тишина, кофе и розетка (kk)",
    "request": {
      "location": null,
      "time_budget_min": 60,
      "mode": "walk",
      "profile": {
        "with_kids": false,
        "tourist": false,
        "accessibility": false,
        "group_size": 1
      },
      "lang": "kk",
      "now": "2026-10-18T17:00:00+05:00",
      "query": "Мен Бәйтерек маңындамын. Бір сағат жұмыс істеуге кофе мен розеткасы бар тыныш орын керек. Розетка не тыныштық туралы дерек болмаса, соны айтыңыз."
    },
    "expect": {
      "status_codes": [
        200
      ],
      "outcome": "recommendations",
      "relevant_poi_ids": [],
      "count_between": [
        1,
        3
      ],
      "categories_any": [
        "cafe",
        "coworking",
        "library"
      ]
    },
    "tags": [
      "organizer",
      "kk",
      "work",
      "landmark",
      "dev"
    ]
  },
  {
    "id": "organizer_kids_kk",
    "scenario": "Пример организаторов: площадка или интерактивный музей (kk)",
    "request": {
      "location": null,
      "time_budget_min": 60,
      "mode": "walk",
      "profile": {
        "with_kids": true,
        "tourist": false,
        "accessibility": false,
        "group_size": 2
      },
      "lang": "kk",
      "now": "2026-10-18T17:00:00+05:00",
      "query": "Мен баламен EXPO маңындамын. Бір сағатқа балалар алаңы немесе интерактивті музей іздеймін. Балаларға жағдай барын дерексіз уәде етпеңіз."
    },
    "expect": {
      "status_codes": [
        200
      ],
      "outcome": "recommendations",
      "relevant_poi_ids": [],
      "count_between": [
        1,
        3
      ],
      "categories_any": [
        "playground",
        "museum"
      ]
    },
    "tags": [
      "organizer",
      "kk",
      "kids",
      "landmark",
      "dev"
    ]
  },
  {
    "id": "organizer_airport_kk",
    "scenario": "Пример организаторов: турист перед вылетом (kk)",
    "request": {
      "location": null,
      "time_budget_min": 60,
      "mode": "car",
      "profile": {
        "with_kids": false,
        "tourist": true,
        "accessibility": false,
        "group_size": 1
      },
      "lang": "kk",
      "now": "2026-10-18T13:00:00+05:00",
      "query": "Мен туристпін, Астана әуежайындамын. Ұшуға 2 сағат бар. Қайтуға, бақылауға және қорға 60 минут қалдырамын. Көлігім бар, серуенге ең көбі 60 минут. Шығу тәуекелді болса, түсіндіріңіз."
    },
    "expect": {
      "status_codes": [
        200
      ],
      "outcome": "recommendations",
      "relevant_poi_ids": [],
      "count_between": [
        1,
        3
      ]
    },
    "tags": [
      "organizer",
      "kk",
      "airport",
      "landmark",
      "return_reserve",
      "manual_review",
      "dev"
    ]
  },
  {
    "id": "organizer_night_kk",
    "scenario": "Пример организаторов: необычное ночью (kk)",
    "request": {
      "location": null,
      "time_budget_min": 60,
      "mode": "walk",
      "profile": {
        "with_kids": false,
        "tourist": false,
        "accessibility": false,
        "group_size": 1
      },
      "lang": "kk",
      "now": "2026-10-18T23:30:00+05:00",
      "query": "Мен Бәйтерек маңындамын, уақыт 23:30. Бір сағатқа заңды әрі ерекше түнгі іс іздеймін. Расталған дерексіз орынды ашық деп айтпаңыз."
    },
    "expect": {
      "status_codes": [
        200
      ],
      "outcome": "recommendations",
      "relevant_poi_ids": [],
      "count_between": [
        1,
        3
      ]
    },
    "tags": [
      "organizer",
      "kk",
      "night",
      "landmark",
      "dev"
    ]
  },
  {
    "id": "organizer_walk_en",
    "scenario": "Пример организаторов: прогулка 30–60 минут (en)",
    "request": {
      "location": null,
      "time_budget_min": 60,
      "mode": "walk",
      "profile": {
        "with_kids": false,
        "tourist": false,
        "accessibility": false,
        "group_size": 1
      },
      "lang": "en",
      "now": "2026-10-18T17:00:00+05:00",
      "query": "I am near Mega Silk Way and want a 30–60 minute walk. What would you suggest?"
    },
    "expect": {
      "status_codes": [
        200
      ],
      "outcome": "recommendations",
      "relevant_poi_ids": [],
      "count_between": [
        1,
        3
      ],
      "categories_any": [
        "park",
        "viewpoint",
        "attraction",
        "monument",
        "mall"
      ]
    },
    "tags": [
      "organizer",
      "en",
      "walk",
      "landmark",
      "frozen_holdout"